{
  "schema_version": "ce-setup-prerequisite-preflight/v1",
  "artifact_kind": "source-bound-contract-preflight",
  "producer": "scripts/check-ce-localization-review.cjs",
  "source_snapshot": {
    "repository": "spec-first",
    "head": "aa40c0f3c16beaa06e492702ff68d6d4c8953271",
    "dirty": false,
    "dirty_paths": [],
    "dirty_path_manifest_sha256": "e3b0c44298fc1c149afbf4c8996fb92427ae41e4649b934ca495991b7852b855",
    "source_tree_hash": "223d4b203bceb0ab828a0942ee7d7b3d9b4e9161ba87e7709c89880fc9293962",
    "inventory_hash": "d39848f1ef49a8a8f87978eee9a971b0ecec1c768b519fd9693b6d63d20ae0fe",
    "scope_contract": {
      "source_roots": [
        "CLAUDE.md",
        "AGENTS.md",
        "skills",
        "templates",
        "src",
        "scripts",
        "tests",
        "docs",
        "README.md",
        "README.en.md",
        "README.zh-CN.md",
        "CHANGELOG.md",
        "package.json"
      ],
      "excluded_run_outputs": [
        "docs/validation/2026-08-19-ce-post-3-20-full-window-name-status.md",
        "docs/validation/2026-08-19-ce-post-3-20-adjudication-input.json",
        "docs/validation/2026-08-19-ce-post-3-20-adjudication.json",
        "docs/validation/2026-08-19-ce-post-3-20-full-window-reconciliation-v2.json",
        "docs/validation/2026-08-19-ce-post-3-20-full-window-reconciliation-v2.md",
        "docs/validation/2026-08-19-spec-first-current-skill-package-inventory-v2.json",
        "docs/validation/2026-08-19-ce-post-3-20-evidence-exceptions.json",
        "docs/validation/2026-08-19-ce-post-3-20-ledger-patches/**",
        "docs/validation/ce-localization/**"
      ]
    },
    "hash_algorithm": {
      "name": "sha256",
      "version": "canonical-source-manifest-v1"
    }
  },
  "public_entrypoint_disposition": "reuse-spec-runtime-setup-only",
  "contracts": [
    {
      "contract_id": "mode-side-effect",
      "status": "confirmed",
      "reason_code": "mode-side-effect-contract-current",
      "owner": "skills/spec-runtime-setup",
      "source_refs": [
        "skills/spec-runtime-setup/SKILL.md",
        "skills/spec-runtime-setup/scripts/lib/mode-policy.cjs",
        "skills/spec-runtime-setup/scripts/lib/runtime-executor.cjs",
        "docs/contracts/verification/ce-setup-side-effect.schema.json"
      ],
      "test_refs": [
        "tests/unit/mcp-setup-mode-target.test.js",
        "tests/unit/mcp-setup-entrypoint.test.js"
      ],
      "next_action": "Rerun the focused mode and side-effect tests after any Runtime Setup mode change.",
      "status_authority": "deterministic-source-check"
    },
    {
      "contract_id": "source-snapshot",
      "status": "confirmed",
      "reason_code": "source-snapshot-producer-current",
      "owner": "scripts/check-ce-localization-review.cjs",
      "source_refs": [
        "scripts/check-ce-localization-review.cjs",
        "scripts/check-ce-upstream-reconciliation.cjs",
        "docs/contracts/verification/ce-setup-snapshot.schema.json"
      ],
      "test_refs": [
        "tests/unit/ce-localization-review-contracts.test.js",
        "tests/unit/ce-setup-localization-contracts.test.js"
      ],
      "next_action": "Refresh all source-bound artifacts whenever HEAD, dirty paths, source tree, or inventory changes.",
      "status_authority": "deterministic-source-check"
    },
    {
      "contract_id": "project-config-validity",
      "status": "confirmed",
      "reason_code": "local-config-structure-contract-current",
      "owner": "skills/spec-runtime-setup/scripts/lib/project-config.cjs",
      "source_refs": [
        "skills/spec-runtime-setup/scripts/lib/project-config.cjs",
        "skills/spec-runtime-setup/references/config-template.yaml"
      ],
      "test_refs": [
        "tests/unit/mcp-setup-project-config.test.js"
      ],
      "next_action": "Preserve syntax, duplicate-key, and unowned-key checks without taking over consumer-specific value validation.",
      "status_authority": "deterministic-source-check"
    },
    {
      "contract_id": "runtime-status-projection",
      "status": "confirmed",
      "reason_code": "runtime-status-projection-current",
      "owner": "src/cli/commands/doctor.js",
      "source_refs": [
        "src/cli/commands/doctor.js",
        "src/cli/helpers/setup-facts.js",
        "docs/contracts/verification/runtime-status-projection.schema.json"
      ],
      "test_refs": [
        "tests/unit/doctor-output.test.js",
        "tests/unit/doctor-runtime-assets.test.js"
      ],
      "next_action": "Preserve the versioned projection when setup or doctor adds a status or disposition.",
      "status_authority": "deterministic-source-check"
    },
    {
      "contract_id": "host-invocation-receipt",
      "status": "confirmed",
      "reason_code": "host-loaded-root-binding-current",
      "owner": "skills/spec-runtime-setup/scripts/lib/host-authority.cjs",
      "source_refs": [
        "skills/spec-runtime-setup/scripts/lib/host-authority.cjs",
        "skills/spec-runtime-setup/scripts/setup.cjs",
        "docs/contracts/verification/host-invocation-receipt.schema.json"
      ],
      "test_refs": [
        "tests/unit/mcp-setup-mode-target.test.js",
        "tests/unit/host-runtime-projection-contracts.test.js"
      ],
      "next_action": "Keep production main enforcement enabled and reject mismatched or unrecognized loaded Skill roots.",
      "status_authority": "deterministic-source-check"
    },
    {
      "contract_id": "consumer-inventory",
      "status": "confirmed",
      "reason_code": "consumer-inventory-current",
      "owner": "scripts/check-ce-localization-review.cjs",
      "source_refs": [
        "skills/spec-runtime-setup/references/config-template.yaml",
        "src/verification/profile-loader.js"
      ],
      "test_refs": [
        "tests/unit/mcp-setup-config-consumers.test.js"
      ],
      "next_action": "Refresh exact source anchors after any local config key or consumer change.",
      "status_authority": "deterministic-source-check"
    }
  ],
  "consumer_inventory": {
    "schema_version": "ce-setup-config-consumer-inventory/v1",
    "status": "confirmed",
    "rows": [
      {
        "key": "brainstorm_output",
        "consumer_kind": "skill-prose/native-read",
        "owner": "skills/spec-brainstorm",
        "source_ref": "skills/spec-brainstorm/references/output-mode.md",
        "source_line": 13,
        "source_excerpt": "3. **Config.** If steps 1-2 did not resolve and the config file read above has an **active (non-commented)** `brainstorm_output:` key whose value matches `md` or `html` (case-insensitive), use it. Missing, invalid, or commented values fall through silently. Critical: lines starting with `#` are YAML comments and must be ignored — the shipped config template includes commented examples like `# brainstorm_output: html` to document the option, and matching those as active settings would silently fo",
        "fallback_boundary": "consumer-owned",
        "blocking_scope": "consumer-local-only",
        "setup_facts_consumer": false
      },
      {
        "key": "feedback_sources",
        "consumer_kind": "skill-prose/native-read",
        "owner": "skills/spec-sweep",
        "source_ref": "skills/spec-sweep/SKILL.md",
        "source_line": 85,
        "source_excerpt": "- Config file missing, or it has no `feedback_sources` key -> first run -> Phase 1.",
        "fallback_boundary": "consumer-owned",
        "blocking_scope": "consumer-local-only",
        "setup_facts_consumer": false
      },
      {
        "key": "ideate_output",
        "consumer_kind": "skill-prose/native-read",
        "owner": "skills/spec-ideate",
        "source_ref": "skills/spec-ideate/SKILL.md",
        "source_line": 101,
        "source_excerpt": "Output config resolution uses the active (non-commented) `ideate_output:` key and defaults to `html` (pipeline runs force `md`). Authorized-dispatch examples and inline fallback cost shape are defined in the owning references; do not claim fresh-context or independent-agent coverage when dispatch is unavailable.",
        "fallback_boundary": "consumer-owned",
        "blocking_scope": "consumer-local-only",
        "setup_facts_consumer": false
      },
      {
        "key": "plan_output",
        "consumer_kind": "skill-prose/native-read",
        "owner": "skills/spec-plan",
        "source_ref": "skills/spec-plan/references/output-mode.md",
        "source_line": 19,
        "source_excerpt": "3. **Config.** If steps 1-2 did not resolve and the configuration read at this boundary has an **active (non-commented)** `plan_output:` key whose value matches `md` or `html` (case-insensitive), use it. Missing, invalid, or commented values fall through silently. Commented template examples are not settings.",
        "fallback_boundary": "consumer-owned",
        "blocking_scope": "consumer-local-only",
        "setup_facts_consumer": false
      },
      {
        "key": "plan_skip_scoping_confirm",
        "consumer_kind": "skill-prose/native-read",
        "owner": "skills/spec-plan",
        "source_ref": "skills/spec-plan/references/output-mode.md",
        "source_line": 34,
        "source_excerpt": "3. **Config.** An **active (non-commented)** `plan_skip_scoping_confirm:` key matching `true`/`false`. Commented (`#`-prefixed) or invalid values fall through silently.",
        "fallback_boundary": "consumer-owned",
        "blocking_scope": "consumer-local-only",
        "setup_facts_consumer": false
      },
      {
        "key": "pulse_analytics_source",
        "consumer_kind": "skill-prose/native-read",
        "owner": "skills/spec-product-pulse",
        "source_ref": "skills/spec-product-pulse/SKILL.md",
        "source_line": 63,